{
  "$schema": "./schema.json",
  "title": "missing form",
  "cooldown": 5,
  "events": {
    "start": {
      "text": "On a unusually calm Tuesday morning, you read through your spacemails and find one from an obscure administration you've never heard about - the PETTEE (Planetoid and Exoplanet Tenaciously Tactical Executive Embassy).",
      "next": [
        {
          "event": "first_mail_content"
        }
      ]
    },
    "first_mail_content": {
      "text": "They complain about some form you were supposed to fill before being allowed to deploy a new species to the planet - one where you accept to be liable if any specimen of the species is found on another planet in the future. They're threatening you of legal repercussions if you don't pay penalties and fill the form immediately.",
      "choices": [
        {
          "text": "“That's obviously a scam!” [ignore it]",
          "next": [
            {
              "event": "no_followup_scam_suspicion",
              "in": 3,
              "weight": 1
            },
            {
              "event": "followup_scam_suspicion",
              "in": 3,
              "weight": 4
            }
          ]
        },
        {
          "text": "“I'm pretty sure they're bluffing about these penalty to scare me into paying them. I'll just fill their form.”",
          "next": [
            {
              "event": "form_filled_fine_unpaid",
              "in": 3
            },
            {
              "event": "pettee_demands_fine",
              "in": 3
            }
          ]
        },
        {
          "text": "“I can't stand losing time with any administration. I'll fill their form and pay the penalties.”",
          "next": [
            {
              "event": "pay_fine"
            }
          ]
        }
      ]
    },
    "no_followup_scam_suspicion": {
      "text": "It's been a while since you haven't had news from the PETTEE administration which was asking you to pay a fee for a missing form. Either it was an actual scam or maybe they're so disorganized they've forgotten about you."
    },
    "followup_scam_suspicion": {
      "text": "You receive another spacemail from PETTEE, that allegedly legitimate administration who wanted you to pay them and fill a form.",
      "choices": [
        {
          "text": "“These scammers don't give up easily, I'll give them that.” [keep ignoring their demands]",
          "next": [
            {
              "event": "manager_steps_in",
              "in": 3
            },
            {
              "event": "no_followup_scam_suspicion",
              "in": 3
            }
          ]
        },
        {
          "text": "“Maybe they're actually legit… I'd better do as they say.”",
          "next": [
            {
              "event": "pay_fine"
            }
          ]
        },
        {
          "text": "Pretend you've filled the form after the first warning.",
          "next": [
            {
              "event": "manager_steps_in_after_lie"
            },
            {
              "event": "cool_clerk"
            },
            {
              "event": "form_unfilled_fine_unpaid"
            }
          ]
        }
      ]
    },
    "pay_fine": {
      "text": "You pay the fine and fill the form.",
      "effects": {
        "pay_fine": true
      }
    },
    "manager_steps_in": {
      "text": "You receive a call from your manager, who sounds… angry, to say the least. “What do you mean you haven't filled the PETTEE form? Everybody knows this is like the first thing to do when introducing a new species to a planetoid or an exoplanet! Do you also need me to check if you introduced a carnivorous species to a completely vegetal world? Just pay the dang fine and send them their form or I swear to God…”",
      "next": [
        {
          "event": "pay_fine"
        }
      ]
    },
    "manager_steps_in_after_lie": {
      "text": "You soon receive a call from your manager, who sounds… angry, to say the least. “Tell me why I'm getting calls from PETTEE about you lying that you've filled a form when their records clearly show it's not the case? Even interns know filling that form is like the first thing to do when introducing a new species to a planetoid or an exoplanet! Do you also need me to check if you introduced a carnivorous species to a completely vegetal world? Just pay the dang fine and send them their form or I swear to God…”",
      "next": [
        {
          "event": "pay_fine"
        }
      ]
    },
    "cool_clerk": {
      "text": "You soon hear from an obviously very laid-back clerk from PETTEE. “Hey pal, seems like we've lost that form or whatevs, send it again plz”",
      "choices": [
        {
          "text": "[Fill the form - seems like they've forgotten the fine]",
          "next": [
            {
              "event": "form_filled_fine_unpaid",
              "in": 3
            }
          ]
        },
        {
          "text": "[Pay the fine and fill the form]",
          "next": [
            {
              "event": "pay_fine"
            }
          ]
        }
      ]
    },
    "form_filled_fine_unpaid": {
      "text": "PETTEE seems to have forgotten about you since you filled their form, even though you didn't pay their fine."
    },
    "form_unfilled_fine_unpaid": {
      "text": "PETTEE seems to have completely forgotten about you even though you neither filled their form nor payed their fine."
    },
    "pettee_demands_fine": {
      "text": "You hear back from PETTEE. They acknowledge they've received the form but are still waiting for the payment of the fine. “*Sigh* I've underestimated them…”",
      "next": [
        {
          "event": "fine_paid_after_form_filled"
        }
      ]
    },
    "fine_paid_after_form_filled": {
      "text": "You pay the fine after all.",
      "effects": {
        "pay_fine": true
      }
    }
  },
  "effects": {
    "pay_fine": {
      "type": "instant",
      "operation": "subtract",
      "target": "money",
      "value": 100
    }
  }
}
